:START_ID,:END_ID,:TYPE,ratio,rule_type,description
mandapa_6,PratisthaAvasyakaBhavana,IS_A,,HIERARCHY,"A pavilion or hall (mandapa) is a type of building that requires a consecration ritual (pratistha) upon its completion, as specified in verses 18.211-212."
natyasala,PratisthaAvasyakaBhavana,IS_A,,HIERARCHY,"A theatre (natyasala) is a type of building that requires a consecration ritual (pratistha) upon its completion, as specified in verses 18.211-212."
matha_2,PratisthaAvasyakaBhavana,IS_A,,HIERARCHY,"A monastery (matha) is a type of building that requires a consecration ritual (pratistha) upon its completion, as specified in verses 18.211-212."
hiranyagarbha_sala,PratisthaAvasyakaBhavana,IS_A,,HIERARCHY,"A hall for the gold embryo ritual (hiranyagarbha_sala) is a type of building that requires a consecration ritual (pratistha) upon its completion, as specified in verses 18.211-212."
tulapurusa_sala,PratisthaAvasyakaBhavana,IS_A,,HIERARCHY,"A building for the ritual of weighing (tulapurusa_sala) is a type of building that requires a consecration ritual (pratistha) upon its completion, as specified in verses 18.211-212."
visvakostha,PratisthaAvasyakaBhavana,IS_A,,HIERARCHY,"A visvakostha is a type of building that requires a consecration ritual (pratistha) upon its completion, as specified in verses 18.211-212."
prapa,PratisthaAvasyakaBhavana,IS_A,,HIERARCHY,"A shed (prapa) is a type of building that requires a consecration ritual (pratistha) upon its completion, as specified in verses 18.211-212."
dhanyagara_2,PratisthaAvasyakaBhavana,IS_A,,HIERARCHY,"A granary (dhanyagara) is a type of building that requires a consecration ritual (pratistha) upon its completion, as specified in verses 18.211-212."
mahanasa,PratisthaAvasyakaBhavana,IS_A,,HIERARCHY,"A great kitchen (mahanasa) is a type of building that requires a consecration ritual (pratistha) upon its completion, as specified in verses 18.211-212."
ratna_2,kumbha_6,LOCATED_BELOW,,SPATIAL,"During the consecration ritual, precious stones (ratna) are to be placed underneath the ritual vase (kumbha), as stated in verse 18.215b."
hiranya,kumbha_6,LOCATED_BELOW,,SPATIAL,"During the consecration ritual, gold (hiranya) is to be placed underneath the ritual vase (kumbha), as stated in verse 18.215b."
Ekatala_Prasada_Unnata,Ekatala_Prasada_Vistara,HAS_DIMENSION_RATIO,1.42857,MEASUREMENT,"The height of a one-storeyed temple can be 10/7ths of its width, a proportion known as Santika."
Ekatala_Prasada_Unnata,Ekatala_Prasada_Vistara,HAS_DIMENSION_RATIO,1.5,MEASUREMENT,"The height of a one-storeyed temple can be one and a half times its width, a proportion known as Paustika."
Ekatala_Prasada_Unnata,Ekatala_Prasada_Vistara,HAS_DIMENSION_RATIO,1.75,MEASUREMENT,"The height of a one-storeyed temple can be one and three-quarters times its width, a proportion known as Jayada."
Ekatala_Prasada_Unnata,Ekatala_Prasada_Vistara,HAS_DIMENSION_RATIO,2.0,MEASUREMENT,"The height of a one-storeyed temple can be twice its width, a proportion known as Adbhuta."
Caturasra_Prasada,prasada,IS_A,,HIERARCHY,A temple (Prasada) can have a square (Caturasra) plan.
Vrtta_Prasada,prasada,IS_A,,HIERARCHY,A temple (Prasada) can have a circular (Vrtta) plan.
Ayatasra_Prasada,prasada,IS_A,,HIERARCHY,A temple (Prasada) can have a rectangular (Ayatasra) plan.
Vrittayata_Prasada,prasada,IS_A,,HIERARCHY,A temple (Prasada) can have an elliptic (Vrittayata) plan.
Gajaprstha_Prasada,prasada,IS_A,,HIERARCHY,A temple (Prasada) can have an apsidal (Gajaprstha) plan.
Sadasra_Prasada,prasada,IS_A,,HIERARCHY,A temple (Prasada) can have a hexagonal (Sadasra) plan.
Astasra_Prasada,prasada,IS_A,,HIERARCHY,A temple (Prasada) can have an octagonal (Astasra) plan.
Mandapa_Vistara,Garbhagrha_Vistara,HAS_DIMENSION_RATIO,1.0,MEASUREMENT,The width of the pavilion (Mandapa) can be equal to the width of the shrine (Garbhagrha).
Mandapa_Vistara,Garbhagrha_Vistara,HAS_DIMENSION_RATIO,0.75,MEASUREMENT,The width of the pavilion (Mandapa) can be three-quarters of the width of the shrine (Garbhagrha).
Mandapa_Vistara,Garbhagrha_Vistara,HAS_DIMENSION_RATIO,0.5,MEASUREMENT,The width of the pavilion (Mandapa) can be half the width of the shrine (Garbhagrha).
Mandapa_Vistara,Prasada_Vistara,HAS_DIMENSION_RATIO,1.0,MEASUREMENT,"If a covered passage and porch exist, the pavilion's width is equal to the temple's width."
Mandapa_Bhitti_Ghana,Garbhagrha_Bhitti_Ghana,HAS_DIMENSION_RATIO,1.0,MEASUREMENT,The wall thickness of the pavilion can be equal to the wall thickness of the shrine.
Mandapa_Bhitti_Ghana,Garbhagrha_Bhitti_Ghana,HAS_DIMENSION_RATIO,0.75,MEASUREMENT,The wall thickness of the pavilion can be three-quarters of the wall thickness of the shrine.
Mandapa_Bhitti_Ghana,Garbhagrha_Bhitti_Ghana,HAS_DIMENSION_RATIO,0.5,MEASUREMENT,The wall thickness of the pavilion can be half the wall thickness of the shrine.
Antarala_Bhitti_Ghana,Garbhagrha_Bhitti_Ghana,HAS_DIMENSION_RATIO,1.0,MEASUREMENT,The wall thickness of the covered passage can be equal to the wall thickness of the shrine.
Antarala_Bhitti_Ghana,Garbhagrha_Bhitti_Ghana,HAS_DIMENSION_RATIO,0.75,MEASUREMENT,The wall thickness of the covered passage can be three-quarters of the wall thickness of the shrine.
Antarala_Bhitti_Ghana,Garbhagrha_Bhitti_Ghana,HAS_DIMENSION_RATIO,0.5,MEASUREMENT,The wall thickness of the covered passage can be half the wall thickness of the shrine.
vimana_3,prasada,SYNONYM_OF,,DEFINITION,The term 'Vimana' is a synonym for 'Prasada' (temple/dwelling).
bhavana_2,prasada,SYNONYM_OF,,DEFINITION,The term 'Bhavana' is a synonym for 'Prasada' (temple/dwelling).
harmya_2,prasada,SYNONYM_OF,,DEFINITION,The term 'Harmya' is a synonym for 'Prasada' (temple/dwelling).
saudha,prasada,SYNONYM_OF,,DEFINITION,The term 'Saudha' is a synonym for 'Prasada' (temple/dwelling).
dhaman_2,prasada,SYNONYM_OF,,DEFINITION,The term 'Dhaman' is a synonym for 'Prasada' (temple/dwelling).
niketana,prasada,SYNONYM_OF,,DEFINITION,The term 'Niketana' is a synonym for 'Prasada' (temple/dwelling).
sadana,prasada,SYNONYM_OF,,DEFINITION,The term 'Sadana' is a synonym for 'Prasada' (temple/dwelling).
sadman,prasada,SYNONYM_OF,,DEFINITION,The term 'Sadman' is a synonym for 'Prasada' (temple/dwelling).
Geha,prasada,SYNONYM_OF,,DEFINITION,The term 'Geha' is a synonym for 'Prasada' (temple/dwelling).
Adhyavasanaka,prasada,SYNONYM_OF,,DEFINITION,The term 'Adhyavasanaka' is a synonym for 'Prasada' (temple/dwelling).
grha_5,prasada,SYNONYM_OF,,DEFINITION,The term 'Grha' is a synonym for 'Prasada' (temple/dwelling).
alaya,prasada,SYNONYM_OF,,DEFINITION,The term 'Alaya' is a synonym for 'Prasada' (temple/dwelling).
nilaya,prasada,SYNONYM_OF,,DEFINITION,The term 'Nilaya' is a synonym for 'Prasada' (temple/dwelling).
vasa_6,prasada,SYNONYM_OF,,DEFINITION,The term 'Vasa' is a synonym for 'Prasada' (temple/dwelling).
aspada,prasada,SYNONYM_OF,,DEFINITION,The term 'Aspada' is a synonym for 'Prasada' (temple/dwelling).
vastu_3,prasada,SYNONYM_OF,,DEFINITION,The term 'Vastu' is a synonym for 'Prasada' (temple/dwelling).
Vastuka,prasada,SYNONYM_OF,,DEFINITION,The term 'Vastuka' is a synonym for 'Prasada' (temple/dwelling).
ksetra,prasada,SYNONYM_OF,,DEFINITION,The term 'Ksetra' is a synonym for 'Prasada' (temple/dwelling).
āyatana,prasada,SYNONYM_OF,,DEFINITION,The term 'Ayatana' is a synonym for 'Prasada' (temple/dwelling).
vesman_2,prasada,SYNONYM_OF,,DEFINITION,The term 'Vesman' is a synonym for 'Prasada' (temple/dwelling).
mandira_2,prasada,SYNONYM_OF,,DEFINITION,The term 'Mandira' is a synonym for 'Prasada' (temple/dwelling).
Dhisnyaka,prasada,SYNONYM_OF,,DEFINITION,The term 'Dhisnyaka' is a synonym for 'Prasada' (temple/dwelling).
pada_5,prasada,SYNONYM_OF,,DEFINITION,The term 'Pada' is a synonym for 'Prasada' (temple/dwelling).
laya,prasada,SYNONYM_OF,,DEFINITION,The term 'Laya' is a synonym for 'Prasada' (temple/dwelling).
ksaya,prasada,SYNONYM_OF,,DEFINITION,The term 'Ksaya' is a synonym for 'Prasada' (temple/dwelling).
agara,prasada,SYNONYM_OF,,DEFINITION,The term 'Agara' is a synonym for 'Prasada' (temple/dwelling).
udavasita,prasada,SYNONYM_OF,,DEFINITION,The term 'Udavasita' is a synonym for 'Prasada' (temple/dwelling).
sthana,prasada,SYNONYM_OF,,DEFINITION,The term 'Sthana' is a synonym for 'Prasada' (temple/dwelling).
Garbhagrha_Vistara,Prasada_Vistara,HAS_DIMENSION_RATIO,0.33333,MEASUREMENT,The width of the sanctum (Garbhagrha) can be one-third of the total temple width.
Garbhagrha_Vistara,Prasada_Vistara,HAS_DIMENSION_RATIO,0.6,MEASUREMENT,The width of the sanctum (Garbhagrha) can be three-fifths of the total temple width.
Garbhagrha_Vistara,Prasada_Vistara,HAS_DIMENSION_RATIO,0.57143,MEASUREMENT,The width of the sanctum (Garbhagrha) can be four-sevenths of the total temple width.
Garbhagrha_Vistara,Prasada_Vistara,HAS_DIMENSION_RATIO,0.55556,MEASUREMENT,The width of the sanctum (Garbhagrha) can be five-ninths of the total temple width.
Garbhagrha_Vistara,Prasada_Vistara,HAS_DIMENSION_RATIO,0.54545,MEASUREMENT,The width of the sanctum (Garbhagrha) can be six-elevenths of the total temple width.
Garbhagrha_Vistara,Prasada_Vistara,HAS_DIMENSION_RATIO,0.53846,MEASUREMENT,The width of the sanctum (Garbhagrha) can be seven-thirteenths of the total temple width.
Garbhagrha_Vistara,Prasada_Vistara,HAS_DIMENSION_RATIO,0.53333,MEASUREMENT,The width of the sanctum (Garbhagrha) can be eight-fifteenths of the total temple width.
Garbhagrha_Vistara,Prasada_Vistara,HAS_DIMENSION_RATIO,0.52941,MEASUREMENT,The width of the sanctum (Garbhagrha) can be nine-seventeenths of the total temple width.
Garbhagrha_Vistara,Prasada_Vistara,HAS_DIMENSION_RATIO,0.5,MEASUREMENT,The width of the sanctum (Garbhagrha) can be one-half of the total temple width.
Padma_Vistara,Sikhara_Agra_Vistara,HAS_DIMENSION_RATIO,0.2,MEASUREMENT,The diameter of the lotus (Padma) at the base of the finial is two-tenths the diameter of the top of the roof.
Kumbha_Vistara,Padma_Vistara,HAS_DIMENSION_RATIO,0.33333,MEASUREMENT,The diameter of the vase (Kumbha) of the finial is one-third the diameter of the finial's lotus (Padma).
Kumbha_Adhah_Griva_Vistara,Kumbha_Vistara,HAS_DIMENSION_RATIO,0.33333,MEASUREMENT,The diameter of the recessed part (Griva) below the finial's vase (Kumbha) is one-third the diameter of the vase.
Kumbha_Urdhva_Griva_Vistara,Kumbha_Vistara,HAS_DIMENSION_RATIO,0.33333,MEASUREMENT,The diameter of the groove (Griva) above the finial's vase (Kumbha) is one-third the diameter of the vase.
Dhvaja_Danda_Unnata,Nasi_Unnata,HAS_DIMENSION_RATIO,0.5,MEASUREMENT,The height of the standard's pole (Dhvaja Danda) can be half the height of the large false dormer windows (Nasi).
Dhvaja_Danda_Unnata,Nasi_Unnata,HAS_DIMENSION_RATIO,0.75,MEASUREMENT,The height of the standard's pole (Dhvaja Danda) can be three-quarters the height of the large false dormer windows (Nasi).
adhisthana,griva_2,HAS_DIMENSION_RATIO,0.333,MEASUREMENT,The height of the stereobate (Adhisthana) of an attic is one-third the height of the attic (Griva) itself.
kṣudranāsikā,māna,HAS_DIMENSION_RATIO,1.5,MEASUREMENT,The width of a small false dormer window (Ksudranasika) can be one and a half modules (Mana).
kṣudranāsikā,māna,HAS_DIMENSION_RATIO,2.0,MEASUREMENT,The width of a small false dormer window (Ksudranasika) can be two modules (Mana).
dvara_4,stambha_5,HAS_DIMENSION_RATIO,0.9,MEASUREMENT,The height of a door (Dvara) can be nine-tenths the height of the pillars (Stambha).
dvara_4,stambha_5,HAS_DIMENSION_RATIO,0.889,MEASUREMENT,The height of a door (Dvara) can be eight-ninths the height of the pillars (Stambha).
dvara_4,stambha_5,HAS_DIMENSION_RATIO,0.875,MEASUREMENT,The height of a door (Dvara) can be seven-eighths the height of the pillars (Stambha).
dvara_4,dvara_4,HAS_DIMENSION_RATIO,0.5,MEASUREMENT,The width of a door (Dvara) is specified as half of its own height.
dvara_4,bhitti,LOCATED_AT,,SPATIAL,"In a royal palace (Rajagrha), the door (Dvara) is situated in the middle of the facade wall."
dvāraśākhā,stambha_5,HAS_DIMENSION_RATIO,1.0,MEASUREMENT,The width of a door jamb (Dvarasakha) can be equal to the width of a pillar (Stambha).
dvāraśākhā,stambha_5,HAS_DIMENSION_RATIO,1.25,MEASUREMENT,The width of a door jamb (Dvarasakha) can be 1.25 times the width of a pillar (Stambha).
dvāraśākhā,dvāraśākhā,HAS_DIMENSION_RATIO,0.5,MEASUREMENT,The thickness of a door jamb (Dvarasakha) can be half of its own width.
dvāraśākhā,dvāraśākhā,HAS_DIMENSION_RATIO,0.75,MEASUREMENT,The thickness of a door jamb (Dvarasakha) can be three-quarters of its own width.
paṭṭikā_6,dvāraśākhā,HAS_DIMENSION_RATIO,0.75,MEASUREMENT,The width of an exterior string course decorated with lotuses (Padmapattika) is three-quarters the thickness of the door jamb (Dvarasakha).
praṇāla,bhitti,LOCATED_AT,,SPATIAL,"A gargoyle (Pranala) is installed with a duct passing through the temple wall to the exterior, extending both above and below the interior floor level."
praṇāla,praṇāla,HAS_DIMENSION_RATIO,1.0,MEASUREMENT,The thickness of a gargoyle (Pranala) can be equal to its width.
praṇāla,praṇāla,HAS_DIMENSION_RATIO,0.75,MEASUREMENT,The thickness of a gargoyle (Pranala) can be three-quarters of its width.
praṇāla,praṇāla,HAS_DIMENSION_RATIO,0.5,MEASUREMENT,The thickness of a gargoyle (Pranala) can be half of its width.
praṇāla_nābhi,praṇāla_nābhi,HAS_DIMENSION_RATIO,1.0,MEASUREMENT,The depth of the duct (Nabhi) within a gargoyle is equal to the duct's width.
praṇāla,praṇāla,HAS_DIMENSION_RATIO,0.6,MEASUREMENT,The width of a gargoyle (Pranala) at its extremity is three-fifths of its width at its base.
siṁhamukha,praṇāla,PART_OF,,HIERARCHY,The spout at the extremity of a gargoyle (Pranala) is fashioned in the form of a lion's mouth (Simhamukha).
praṇāla,prasada,LOCATED_AT,,SPATIAL,A gargoyle (Pranala) is to be installed in the middle of the left facade of the temple.
prasada,vesara_2,IS_A,,DEFINITION,A temple (Prasada) is classified as Vesara style if its roof (Sikhara) and attic (Griva) are circular.
bhadra_2,kesara,PART_OF,,HIERARCHY,A Kesara style building features a forepart (Bhadra) in the middle of its facade.
kuta_7,śikhara,LOCATED_AT,,SPATIAL,"In a Kesara building, aediculae (Kuta) are located at the level of the roof, at the corners and in the middle."
nāsikā,bhadra_2,LOCATED_ABOVE,,SPATIAL,"In a Kesara building, a false dormer-window (Nasika) is located above the forepart (Bhadra)."
bhadra_2,prasada,HAS_DIMENSION_RATIO,0.6,MEASUREMENT,The width of the median forepart (Bhadra) of a Kesara building can be three-fifths the total width of the building.
bhadra_2,prasada,HAS_DIMENSION_RATIO,0.5,MEASUREMENT,The width of the median forepart (Bhadra) of a Kesara building can be three-sixths (one-half) the total width of the building.
bhadra_2,prasada,HAS_DIMENSION_RATIO,0.428,MEASUREMENT,The width of the median forepart (Bhadra) of a Kesara building can be three-sevenths the total width of the building.
bhadra_2,prasada,HAS_DIMENSION_RATIO,0.4,MEASUREMENT,The projection of the median forepart (Bhadra) of a Kesara building can be two-fifths the total width of the building.
bhadra_2,prasada,HAS_DIMENSION_RATIO,0.333,MEASUREMENT,The projection of the median forepart (Bhadra) of a Kesara building can be two-sixths (one-third) the total width of the building.
bhadra_2,prasada,HAS_DIMENSION_RATIO,0.286,MEASUREMENT,The projection of the median forepart (Bhadra) of a Kesara building can be two-sevenths the total width of the building.
prasada,nagara_3,IS_A,,DEFINITION,A building (Prasada) that is square or rectangular in plan is classified as Nagara style.
prasada,dravida_3,IS_A,,DEFINITION,A building (Prasada) that is hexagonal or octagonal in plan is classified as Dravida style.
prasada,vesara_2,IS_A,,DEFINITION,"A building (Prasada) that is circular, elliptical, or apsidal in plan is classified as Vesara style."
prasada,nagara_3,IS_A,,DEFINITION,A building (Prasada) that is square from its base up to the finial (Stupi) is classified as Nagara style.
prasada,dravida_3,IS_A,,DEFINITION,A building (Prasada) that is octagonal from the attic (Griva) upwards is classified as Dravida style.
prasada,vesara_2,IS_A,,DEFINITION,A building (Prasada) that is circular from the attic (Griva) upwards is classified as Vesara style.
Nandin,pūrva_bhūmi,LOCATED_AT,,SPATIAL,"The image of Nandi, a guardian of the door, is placed in the east on the ground floor of the temple."
Kala_3,pūrva_bhūmi,LOCATED_AT,,SPATIAL,"The image of Kala, a guardian of the door, is placed in the east on the ground floor of the temple."
Nandin,dvarapala,IS_A,,HIERARCHY,"Nandi is classified as a Dvarapala, a guardian of the door."
Kala_3,dvarapala,IS_A,,HIERARCHY,"Kala is classified as a Dvarapala, a guardian of the door."
Daksinamurti,dakṣiṇa_bhūmi,LOCATED_AT,,SPATIAL,The image of Daksinamurti is placed in the south on the ground floor of the temple.
acyuta,paścima_bhūmi,LOCATED_AT,,SPATIAL,The image of Acyuta is placed in the west on the ground floor of the temple.
Liṅgasambhava,acyuta,SYNONYM_OF,,DEFINITION,"Lingasambhava is an alternative deity to be placed in the west on the ground floor, in place of Acyuta."
Pitāmaha,uttara_bhūmi,LOCATED_AT,,SPATIAL,The image of Pitamaha is placed in the north on the ground floor of the temple.
Vinayaka,madhya_mukha_maṇḍapa,LOCATED_AT,,SPATIAL,Vinayaka is placed at the center of the facade of the pavilion located before the main shrine.
Vinayaka,dakṣiṇa_maṇḍapa,LOCATED_AT,,SPATIAL,"As an alternative placement, Vinayaka can be located to the south of the pavilion."
Nṛttarūpa,pārśva_Vināyaka,LOCATED_AT,,SPATIAL,"The image of Nrttarupa is placed to the left or right of Vinayaka, on the southern face of the pavilion."
Katyayani,uttara_maṇḍapa,LOCATED_AT,,SPATIAL,The image of Katyayani is placed in the north of the pavilion.
ksetrapala,Katyayani,SYNONYM_OF,,DEFINITION,"Ksetrapala is an alternative deity to be placed in the north of the pavilion, in place of Katyayani."
devatā_pratimā,āsana_or_sthānaka,HAS_PROPERTY,,DEFINITION,Images of deities placed at the cardinal points can be depicted in either a seated (asana) or standing (sthanaka) posture.
purandara,pūrva_dvitīya_tala,LOCATED_AT,,SPATIAL,The image of Purandara is placed in the east on the second floor of the temple.
subrahmanya,purandara,SYNONYM_OF,,DEFINITION,"Subrahmanya is an alternative deity to be placed in the east on the second floor, in place of Purandara."
virabhadra,dakṣiṇa_dvitīya_tala,LOCATED_AT,,SPATIAL,The image of Virabhadra is placed in the south on the second floor of the temple.
narasimha,paścima_dvitīya_tala,LOCATED_AT,,SPATIAL,The image of Narasimha is placed in the west on the second floor of the temple.
Vidhatr,uttara_dvitīya_tala,LOCATED_AT,,SPATIAL,The image of Vidhatr is placed in the north on the second floor of the temple.
dhanada,Vidhatr,SYNONYM_OF,,DEFINITION,"Dhanada is an alternative deity to be placed in the north on the second floor, in place of Vidhatr."
marut,tṛtīya_tala,LOCATED_AT,,SPATIAL,The group of deities known as the Maruts is placed on the third floor of the temple.
amara,sarva_tala,LOCATED_AT,,SPATIAL,Images of the Amaras are to be placed on each floor of the temple.
siddha_2,sarva_tala,LOCATED_AT,,SPATIAL,Images of the Siddhas are to be placed on each floor of the temple.
gandharva_2,sarva_tala,LOCATED_AT,,SPATIAL,Images of the Gandharvas are to be placed on each floor of the temple.
muni_2,sarva_tala,LOCATED_AT,,SPATIAL,Images of the Munis are to be placed on each floor of the temple.
rsabha,karṇa_grīvā_adhiṣṭhāna,LOCATED_AT,,SPATIAL,An image of a bull (vrsabha) is placed at each corner of the base of the attic (griva).
vāhana,dakṣiṇa_pārśva_devatā,LOCATED_AT,,SPATIAL,The mount (vahana) of a deity is to be placed to the right side of that deity's image.
dvi_tala_prāsāda_vistāra,pañca_caturdaśa_hasta,HAS_PROPERTY,,MEASUREMENT,"The width of a two-storeyed temple ranges from 5 or 6 cubits up to 13 or 14 cubits, increasing in increments of 2 cubits."
karṇakūṭa_vistāra,bhūmi_vistāra,HAS_DIMENSION_RATIO,0.1667,MEASUREMENT,"The width of a corner aedicule (karnakuta) is 1 part of the total ground floor width, which is divided into 6 or 7 parts."
bhadra_āyāma,bhūmi_vistāra,HAS_DIMENSION_RATIO,0.4286,MEASUREMENT,"The length of a median aedicule (bhadra) is 2 or 3 parts of the total ground floor width, which is divided into 6 or 7 parts."
adhisthana,prāsāda_utsedha,HAS_DIMENSION_RATIO,0.1071,MEASUREMENT,"The height of the base (adhisthana) is 3 parts of the total temple height, which is divided into 28 parts."
bhūmi,prāsāda_utsedha,HAS_DIMENSION_RATIO,0.2143,MEASUREMENT,"The height of the ground floor (bhumi) is 6 parts of the total temple height, which is divided into 28 parts."
bhūmi_prastara,prāsāda_utsedha,HAS_DIMENSION_RATIO,0.1071,MEASUREMENT,"The height of the ground floor's entablature (prastara) is 3 parts of the total temple height, which is divided into 28 parts."
tāla_3,prāsāda_utsedha,HAS_DIMENSION_RATIO,0.1786,MEASUREMENT,"The height of the upper storey (tala) is 5 parts of the total temple height, which is divided into 28 parts."
tala_prastara,prāsāda_utsedha,HAS_DIMENSION_RATIO,0.0714,MEASUREMENT,"The height of the upper storey's entablature (prastara) is 2 parts of the total temple height, which is divided into 28 parts."
gala_2,prāsāda_utsedha,HAS_DIMENSION_RATIO,0.0357,MEASUREMENT,"The height of the stereobate of the attic (gala) is 1 part of the total temple height, which is divided into 28 parts."
śikhara,prāsāda_utsedha,HAS_DIMENSION_RATIO,0.0714,MEASUREMENT,"The height of the attic (sikhara) is 2 parts of the total temple height, which is divided into 28 parts."
sikha_4,prāsāda_utsedha,HAS_DIMENSION_RATIO,0.1607,MEASUREMENT,"The height of the roof (sikha) is 4.5 parts of the total temple height, which is divided into 28 parts."
stūpi,prāsāda_utsedha,HAS_DIMENSION_RATIO,0.0536,MEASUREMENT,"The height of the finial (stupi) is 1.5 parts of the total temple height, which is divided into 28 parts."
bhūmi,adhisthana,LOCATED_ABOVE,,SPATIAL,The ground floor (bhumi) is located vertically above the base (adhisthana).
bhūmi_prastara,bhūmi,LOCATED_ABOVE,,SPATIAL,The ground floor's entablature (prastara) is located vertically above the ground floor (bhumi).
tāla_3,bhūmi_prastara,LOCATED_ABOVE,,SPATIAL,The upper storey (tala) is located vertically above the ground floor's entablature.
gala_2,tala_prastara,LOCATED_ABOVE,,SPATIAL,The stereobate of the attic (gala) is located vertically above the upper storey's entablature.
śikhara,gala_2,LOCATED_ABOVE,,SPATIAL,The attic (sikhara) is located vertically above its stereobate (gala).
stūpi,sikha_4,LOCATED_ABOVE,,SPATIAL,"The finial (stupi) is the topmost element, located vertically above the roof (sikha)."
Svastika_prāsāda_adhiṣṭhāna,caturasra,HAS_SHAPE,,DEFINITION,The base (adhisthana) of a Svastika temple is square.
Svastika_prāsāda_śikhara,caturasra,HAS_SHAPE,,DEFINITION,The attic (sikhara) of a Svastika temple is square.
Svastika_prāsāda,karnakuta_2,HAS_PART,,HIERARCHY,A Svastika temple has four corner aediculae (karnakuta).
Svastika_prāsāda,bhadrakuta,HAS_PART,,HIERARCHY,A Svastika temple has four median aediculae (bhadra) on its facades.
Svastika_prāsāda,nāsikā,HAS_PART,,HIERARCHY,A Svastika temple has eight small false dormer windows (nasika).
Svastika_prāsāda,kṣudra_nāsikā,HAS_PART,,HIERARCHY,A Svastika temple has forty-eight very small false dormer windows (ksudra-nasika).
ghaṭodbhava_latā,madhya_nirantara_bhitti,LOCATED_AT,,SPATIAL,"Decorative creepers emerging from vases are located on the wall, in the middle of the recesses."
svastika_11,prasada,IS_A,,DEFINITION,A Svastika is a type of temple (prāsāda) which is suitable for all gods (akhiladevatā) and is characterized by features such as arcatures and a socle (upapīṭha).
vipulasundara,prasada,IS_A,,DEFINITION,A Vipulasundara is a type of temple (prāsāda) defined by its corner aediculae (karṇakūṭa) being at a lower height than its median aediculae (śālā).
karnakuta_2,śālā_7,LOCATED_BELOW,,SPATIAL,"In a Vipulasundara temple, the corner aediculae (karṇakūṭa) are positioned at a lower height than the median aediculae (śālā)."
upapitha_3,śālā_7,LOCATED_BELOW,,SPATIAL,"In a Vipulasundara temple, a socle (upapīṭha) is located beneath the median aediculae (śālā)."
adhisthana,stambha_5,HAS_DIMENSION_RATIO,0.1,MEASUREMENT,The height of the stereobate (adhiṣṭhāna) supporting an aedicula is one-tenth (0.1) the height of the pillars (stambha) of its corresponding storey.
śarīra,stambha_5,HAS_DIMENSION_RATIO,0.3,MEASUREMENT,The height of the body (śarīra) of an aedicula is three-tenths (0.3) the height of the pillars (stambha) of its corresponding storey.
prastara_3,stambha_5,HAS_DIMENSION_RATIO,0.175,MEASUREMENT,The height of the entablature (prastara) of an aedicula is one and three-quarter tenths (0.175) the height of the pillars (stambha) of its corresponding storey.
griva_2,stambha_5,HAS_DIMENSION_RATIO,0.125,MEASUREMENT,The height of the attic (grīvā) of an aedicula is one and a quarter tenths (0.125) the height of the pillars (stambha) of its corresponding storey.
śikhara,stambha_5,HAS_DIMENSION_RATIO,0.3,MEASUREMENT,The height of the roof (śikhara) of an aedicula is three-tenths (0.3) the height of the pillars (stambha) of its corresponding storey.
kailasa,prasada,IS_A,,DEFINITION,A Kailāsa is a type of temple (prāsāda) defined by its median aediculae (śālā) being at a lower height than its corner aediculae (karṇakūṭa).
śālā_7,karnakuta_2,LOCATED_BELOW,,SPATIAL,"In a Kailāsa temple, the median aediculae (śālā) are positioned at a lower height than the corner aediculae (karṇakūṭa)."
