:START_ID,:END_ID,:TYPE,ratio,rule_type,description
Alinda_Court,aṁśa_3,HAS_DIMENSION_RATIO,,MEASUREMENT,The gallery surrounding the central court of the Isvarakanta pavilion is 1 unit wide.
Aṅgaṇa_Side,Isvarakanta,PART_OF,,HIERARCHY,"The Isvarakanta pavilion has two side courts (Aṅgaṇa), open to the sky."
Aṅgaṇa_Side,Aṅgaṇa_Central,LOCATED_AT,,SPATIAL,The two side courts are located on both sides of the central court complex.
Aṅgaṇa_Side,aṁśa_3,HAS_DIMENSION_RATIO,,MEASUREMENT,Each side court of the Isvarakanta pavilion is 2 units wide.
Aṅgaṇa_Side,aṁśa_3,HAS_DIMENSION_RATIO,,MEASUREMENT,Each side court of the Isvarakanta pavilion is 5 units long.
Alinda_Perimeter,Isvarakanta,PART_OF,,HIERARCHY,A perimeter portico (Alinda) is a component of the Isvarakanta pavilion.
Alinda_Perimeter,Isvarakanta,LOCATED_AT,,SPATIAL,A portico (Alinda) is arranged all around the Isvarakanta pavilion.
Alinda_Perimeter,aṁśa_3,HAS_DIMENSION_RATIO,,MEASUREMENT,The perimeter portico of the Isvarakanta pavilion is 1 unit wide.
Mukhabhadra,Isvarakanta,PART_OF,,HIERARCHY,A front porch (Mukhabhadra) is a component of the Isvarakanta pavilion.
Mukhabhadra,aṁśa_3,HAS_DIMENSION_RATIO,,MEASUREMENT,The front porch of the Isvarakanta pavilion is 3 units wide.
Mukhabhadra,aṁśa_3,HAS_DIMENSION_RATIO,,MEASUREMENT,The front porch of the Isvarakanta pavilion projects by 1 unit.
adhisthana,Isvarakanta,PART_OF,,HIERARCHY,A base (Adhiṣṭhāna) is a component of the Isvarakanta pavilion.
stambha_5,adhisthana,PART_OF,,HIERARCHY,The base (Adhiṣṭhāna) of the Isvarakanta pavilion supports 84 pillars (Stambha).
sribhadra_2,mandapa_6,IS_A,,HIERARCHY,Sribhadra is a type of pavilion (Mandapa).
sribhadra_2,aṁśa_3,HAS_DIMENSION_RATIO,,MEASUREMENT,The width of the Sribhadra pavilion is 8 units (aṁśa).
sribhadra_2,aṁśa_3,HAS_DIMENSION_RATIO,,MEASUREMENT,"The length of the Sribhadra pavilion is 12 units (aṁśa), which is 4 more than its width."
Aṅgaṇa_Central,sribhadra_2,PART_OF,,HIERARCHY,A central square court (Aṅgaṇa) is part of the Sribhadra pavilion. It may optionally be covered by a lantern.
Aṅgaṇa_Central,aṁśa_3,HAS_DIMENSION_RATIO,,MEASUREMENT,The central court of the Sribhadra pavilion is a square of 2 units side.
Alinda_Inner,sribhadra_2,PART_OF,,HIERARCHY,An inner portico (Alinda) is a component of the Sribhadra pavilion.
Alinda_Inner,Aṅgaṇa_Central,LOCATED_AT,,SPATIAL,An inner portico (Alinda) surrounds the central court of the Sribhadra pavilion.
Alinda_Inner,aṁśa_3,HAS_DIMENSION_RATIO,,MEASUREMENT,The inner portico of the Sribhadra pavilion is 1 unit wide.
Aṅgaṇa_Side,sribhadra_2,PART_OF,,HIERARCHY,"The Sribhadra pavilion has two side courts (Aṅgaṇa), which are covered by lanterns."
Aṅgaṇa_Side,aṁśa_3,HAS_DIMENSION_RATIO,,MEASUREMENT,"Each side court of the Sribhadra pavilion is 7 units long, which is 2 units more than in the Isvarakanta type."
Alinda_Outer,sribhadra_2,PART_OF,,HIERARCHY,An outer gallery (Alinda) is a component of the Sribhadra pavilion.
Alinda_Outer,sribhadra_2,LOCATED_AT,,SPATIAL,An outer gallery (Alinda) is arranged all around the Sribhadra pavilion.
Alinda_Outer,aṁśa_3,HAS_DIMENSION_RATIO,,MEASUREMENT,The outer gallery of the Sribhadra pavilion is 2 units wide.
Mukhabhadra,sribhadra_2,PART_OF,,HIERARCHY,A porch (Mukhabhadra) is a component of the Sribhadra pavilion.
Mukhabhadra,aṁśa_3,HAS_DIMENSION_RATIO,,MEASUREMENT,The porch of the Sribhadra pavilion is 4 units wide.
Mukhabhadra,aṁśa_3,HAS_DIMENSION_RATIO,,MEASUREMENT,The porch of the Sribhadra pavilion projects by 2 units.
adhisthana,sribhadra_2,PART_OF,,HIERARCHY,A base (Adhiṣṭhāna) is a component of the Sribhadra pavilion.
stambha_5,adhisthana,PART_OF,,HIERARCHY,The base (Adhiṣṭhāna) of the Sribhadra pavilion supports 110 pillars (Stambha).
sarvatobhadra_8,mandapa_6,IS_A,,HIERARCHY,Sarvatobhadra is a type of pavilion (Mandapa).
sarvatobhadra_8,aṁśa_3,HAS_DIMENSION_RATIO,,MEASUREMENT,The width of the Sarvatobhadra pavilion is 9 units (aṁśa).
sarvatobhadra_8,aṁśa_3,HAS_DIMENSION_RATIO,,MEASUREMENT,"The length of the Sarvatobhadra pavilion is 13 units (aṁśa), which is 4 more than its width."
Aṅgaṇa_Central,sarvatobhadra_8,PART_OF,,HIERARCHY,A central square court (Aṅgaṇa) is part of the Sarvatobhadra pavilion. It may optionally be covered by a lantern.
Aṅgaṇa_Central,aṁśa_3,HAS_DIMENSION_RATIO,,MEASUREMENT,The central court of the Sarvatobhadra pavilion is a square of 3 units side.
Alinda_Inner,sarvatobhadra_8,PART_OF,,HIERARCHY,An inner portico (Alinda) is a component of the Sarvatobhadra pavilion.
Alinda_Inner,Aṅgaṇa_Central,LOCATED_AT,,SPATIAL,An inner portico (Alinda) surrounds the central court of the Sarvatobhadra pavilion.
Alinda_Inner,aṁśa_3,HAS_DIMENSION_RATIO,,MEASUREMENT,The inner portico of the Sarvatobhadra pavilion is 1 unit wide.
Aṅgaṇa_Side,sarvatobhadra_8,PART_OF,,HIERARCHY,"The Sarvatobhadra pavilion has two side courts (Aṅgaṇa), open to the sky."
Aṅgaṇa_Side,aṁśa_3,HAS_DIMENSION_RATIO,,MEASUREMENT,Each side court of the Sarvatobhadra pavilion is 2 units wide.
Aṅgaṇa_Side,aṁśa_3,HAS_DIMENSION_RATIO,,MEASUREMENT,Each side court of the Sarvatobhadra pavilion is 5 units long.
Alinda_Outer,sarvatobhadra_8,PART_OF,,HIERARCHY,An outer gallery (Alinda) is a component of the Sarvatobhadra pavilion.
Alinda_Outer,sarvatobhadra_8,LOCATED_AT,,SPATIAL,An outer gallery (Alinda) is arranged all around the Sarvatobhadra pavilion.
Alinda_Outer,aṁśa_3,HAS_DIMENSION_RATIO,,MEASUREMENT,The outer gallery of the Sarvatobhadra pavilion is 2 units wide.
Mukhabhadra_FrontBack,sarvatobhadra_8,PART_OF,,HIERARCHY,The Sarvatobhadra pavilion has two foreparts (Mukhabhadra) on the front and back.
Mukhabhadra_FrontBack,aṁśa_3,HAS_DIMENSION_RATIO,,MEASUREMENT,The front and back foreparts of the Sarvatobhadra pavilion are 5 units wide.
Mukhabhadra_FrontBack,aṁśa_3,HAS_DIMENSION_RATIO,,MEASUREMENT,The front and back foreparts of the Sarvatobhadra pavilion are 2 units deep.
Mukhabhadra_Side,sarvatobhadra_8,PART_OF,,HIERARCHY,The Sarvatobhadra pavilion has two foreparts (Mukhabhadra) on the sides.
Mukhabhadra_Side,aṁśa_3,HAS_DIMENSION_RATIO,,MEASUREMENT,The side foreparts of the Sarvatobhadra pavilion are 3 units wide.
Mukhabhadra_Side,aṁśa_3,HAS_DIMENSION_RATIO,,MEASUREMENT,The side foreparts of the Sarvatobhadra pavilion are 1 unit deep.
Haladantabhitti,sarvatobhadra_8,PART_OF,,HIERARCHY,Ploughshare walls (Haladantabhitti) are components of the Sarvatobhadra pavilion.
Haladantabhitti,sarvatobhadra_8,LOCATED_AT,,SPATIAL,Ploughshare walls (Haladantabhitti) are located in the corners of the Sarvatobhadra pavilion.
adhisthana,sarvatobhadra_8,PART_OF,,HIERARCHY,A base (Adhiṣṭhāna) is a component of the Sarvatobhadra pavilion.
stambha_5,adhisthana,PART_OF,,HIERARCHY,The base (Adhiṣṭhāna) of the Sarvatobhadra pavilion supports 128 pillars (Stambha).
chanda_mandapa,chanda_mandapa,HAS_DIMENSION_RATIO,,MEASUREMENT,"For a pavilion of the 'chanda' mode, its length is defined as its width plus one unit."
vikalpa_mandapa,vikalpa_mandapa,HAS_DIMENSION_RATIO,,MEASUREMENT,"For a pavilion of the 'vikalpa' mode, its length is defined as its width plus two units."
abhasa_mandapa,abhasa_mandapa,HAS_DIMENSION_RATIO,,MEASUREMENT,"For a pavilion of the 'abhasa' mode, its length is defined as its width plus three units."
dandaka_4,jati_plan,IS_A,,HIERARCHY,Dandaka is a type of quadrangular plan classified under the 'jati' mode.
svastibhadra,jati_plan,IS_A,,HIERARCHY,Svastibhadra is a type of quadrangular plan classified under the 'jati' mode.
Padma,jati_plan,IS_A,,HIERARCHY,Padma is a type of quadrangular plan classified under the 'jati' mode.
krakarabhadrā,jati_plan,IS_A,,HIERARCHY,Krakarabhadra is a type of quadrangular plan classified under the 'jati' mode.
sanmukha_2,jati_plan,IS_A,,HIERARCHY,Sanmukha is a type of quadrangular plan classified under the 'jati' mode.
langala_2,jati_plan,IS_A,,HIERARCHY,Langala is a type of quadrangular plan classified under the 'jati' mode.
mauli,jati_plan,IS_A,,HIERARCHY,Mauli is a type of quadrangular plan classified under the 'jati' mode.
grhamandapa,mandapa_6,IS_A,,HIERARCHY,"A Grhamandapa, or 'house-pavilion', is a type of pavilion defined by incorporating elements and the plan of a house, and includes a canopy."
prasadamandapa,mandapa_6,IS_A,,HIERARCHY,"A Prasadamandapa, or 'pavilion in the form of a temple', is a type of pavilion whose center resembles a temple sanctum, includes an aisle, and is built with the six architectural levels starting from the base (adhisthana)."
grhaprasadamandapa,mandapa_6,IS_A,,HIERARCHY,"A Grhaprasadamandapa, or 'house-temple pavilion', is a hybrid pavilion type that combines architectural elements from both a house (grha) and a temple (prasada)."
malikamandapa,mandapa_6,IS_A,,HIERARCHY,A Malikamandapa is a type of pavilion defined by the presence of a storey (tala) built above it.
tāla_3,mandapa_6,LOCATED_ABOVE,,SPATIAL,A storey (tala) located above a pavilion classifies it as a Malikamandapa.
iṣṭakā,mandapa_6,PART_OF,,DEFINITION,Bricks (istaka) are a specified construction material for a pavilion (mandapa).
sila,mandapa_6,PART_OF,,DEFINITION,Stone (sila) is a specified construction material for a pavilion (mandapa).
daru,mandapa_6,PART_OF,,DEFINITION,Wood (daru) is a specified construction material for a pavilion (mandapa).
danta,mandapa_6,PART_OF,,DEFINITION,Ivory (danta) is a specified construction material for a pavilion (mandapa).
loha,mandapa_6,PART_OF,,DEFINITION,Metal pieces (loha) are a specified construction material for a pavilion (mandapa).
jalakridamandapa,mandapa_6,IS_A,,HIERARCHY,"A Jalakridamandapa is a specific type of rectangular pavilion designed for water games, equipped with fountains, and can have one or more storeys."
dhara_2,jalakridamandapa,PART_OF,,SPATIAL,Fountains (dhara) are a defining component of a Jalakridamandapa (pavilion for water games).
bhitti,jalakridamandapa,PART_OF,,SPATIAL,A Jalakridamandapa is typically enclosed by a surrounding wall (bhitti).
stambha_pankti,jalakridamandapa,PART_OF,,SPATIAL,"As an alternative to a wall, a Jalakridamandapa can be bordered by a colonnade (stambha pankti)."
mukhabhadra,jalakridamandapa,LOCATED_AT,,SPATIAL,A porch (mukhabhadra) is located on each of the four facades of a Jalakridamandapa.
vitana,jalakridamandapa,LOCATED_AT,,SPATIAL,A canopy (vitana) may be located in the middle of a Jalakridamandapa.
angana_3,jalakridamandapa,LOCATED_AT,,SPATIAL,An open courtyard (angana) may be located in the middle of a Jalakridamandapa as an alternative to a canopy.
sopana,gudhadvara,LOCATED_AT,,SPATIAL,"In a Jalakridamandapa, the stairway (sopana) is positioned behind a concealed door (gudhadvara)."
jalayantra,gudhadvara,LOCATED_AT,,SPATIAL,"Water-filled devices (jalayantra), such as mechanical dolls and animal figures, are installed in front of the concealed door leading to the stairway."
jalakridamandapa_sikhara,jalakridamandapa,PART_OF,,HIERARCHY,"The roof (sikhara) of a Jalakridamandapa can be shaped like a harmya, a pavilion, or a sabha."
kuta_7,jalakridamandapa_sikhara,PART_OF,,SPATIAL,Square aediculae (kuta) are used as decorative elements on the roof of a Jalakridamandapa.
pañjara_3,jalakridamandapa_sikhara,PART_OF,,SPATIAL,Arcatures (panjara) are used as decorative elements on the roof of a Jalakridamandapa.
jalaka,jalakridamandapa_sikhara,PART_OF,,SPATIAL,Latticed windows (jalaka) are used as decorative elements on the roof of a Jalakridamandapa.
nasika,jalakridamandapa_sikhara,PART_OF,,SPATIAL,False dormer windows (nasika) of various types are used as decorative elements on the roof of a Jalakridamandapa.
kunda_2,mandapa_6,LOCATED_IN,,SPATIAL,A basin (kunda) is located either in front of or in the middle of a pavilion (mandapa).
kunda_2,iṣṭakā,HAS_MATERIAL,,DEFINITION,A basin (kunda) can be constructed from brick (istaka).
kunda_2,sila,HAS_MATERIAL,,DEFINITION,A basin (kunda) can be constructed from stone (sila).
dhara_2,kunda_2,PART_OF,,HIERARCHY,A basin (kunda) is equipped with fountains (dhara).
nala,kunda_2,PART_OF,,HIERARCHY,"A basin (kunda) is supplied with ducts (nala), which may be concealed or visible."
mandapa_6,raja_jalakrida,HAS_FUNCTION,,DEFINITION,A pavilion (mandapa) located in a pleasant place is intended for the king's water sports (jalakrida).
mandapa_6,raja,PROVIDES_BENEFIT,,DEFINITION,"A well-decorated pavilion brings women, health, pleasure, and happiness to the king."
stambha_5,khadira,HAS_MATERIAL,,DEFINITION,"Khadira wood is a suitable material for making pillars (stambha) for constructions intended for gods, brahmins, and kings."
stambha_5,nimba,HAS_MATERIAL,,DEFINITION,"Nimba wood is a suitable material for making pillars (stambha) for constructions intended for gods, brahmins, and kings."
stambha_5,śālā_7,HAS_MATERIAL,,DEFINITION,"Sala wood is a suitable material for making pillars (stambha) for constructions intended for gods, brahmins, and kings."
stambha_5,silindhra,HAS_MATERIAL,,DEFINITION,"Silindra wood is a suitable material for making pillars (stambha) for all classes, including gods, brahmins, kings, vaisyas, and sudras."
stambha_5,piśita,HAS_MATERIAL,,DEFINITION,"Pisita wood is a suitable material for making pillars (stambha) for all classes, including gods, brahmins, kings, vaisyas, and sudras."
stambha_5,tinduka,HAS_MATERIAL,,DEFINITION,"Tinduka wood is a suitable material for making pillars (stambha) for all classes, including gods, brahmins, kings, vaisyas, and sudras."
stambha_5,rajadana,HAS_MATERIAL,,DEFINITION,"Rajadana wood is a suitable material for making pillars (stambha) for all classes, including gods, brahmins, kings, vaisyas, and sudras."
stambha_5,madhuka,HAS_MATERIAL,,DEFINITION,"Madhuka wood is a suitable material for making pillars (stambha) for all classes, including gods, brahmins, kings, vaisyas, and sudras."
stambha_5,vrtta_2,HAS_SHAPE,,DEFINITION,Pillars (stambha) in buildings for Vaisya and Sudra may be circular (vrtta) in section.
stambha_5,caturasra,HAS_SHAPE,,DEFINITION,Pillars (stambha) in buildings for Vaisya and Sudra may be square (caturasra) in section.
stambha_5,astasra,HAS_SHAPE,,DEFINITION,Pillars (stambha) in buildings for Vaisya and Sudra may be octagonal (astasra) in section.
stambha_5,sodasasra,HAS_SHAPE,,DEFINITION,Pillars (stambha) in buildings for Vaisya and Sudra may have sixteen sides (sodasasra).
vamsa_5,sarva,IS_SUITABLE_FOR,,DEFINITION,Bamboo (vamsa) is a suitable construction material for all social classes.
tāla_3,sarva,IS_SUITABLE_FOR,,DEFINITION,The palm tree (tala) is a suitable construction material for all social classes.
narikela,sarva,IS_SUITABLE_FOR,,DEFINITION,The coconut tree (narikela) is a suitable construction material for all social classes.
harmya_2,iṣṭakā,HAS_MATERIAL,,DEFINITION,Buildings (harmya) intended for gods (deva) and ascetics (yati) may be constructed from brick (istaka).
harmya_2,sila,HAS_MATERIAL,,DEFINITION,Buildings (harmya) intended for gods (deva) and ascetics (yati) may be constructed from stone (sila).
harmya_2,daru,HAS_MATERIAL,,DEFINITION,Buildings (harmya) intended for gods (deva) and ascetics (yati) may be constructed from wood (daru).
vaisya_harmya,sila,HAS_USAGE_PROHIBITION,,DEFINITION,Stone (sila) is prohibited as a construction material for buildings intended for Vaisya.
sudra_harmya,sila,HAS_USAGE_PROHIBITION,,DEFINITION,Stone (sila) is prohibited as a construction material for buildings intended for Sudra.
mandapa_6,prasada,LOCATED_IN_FRONT_OF,,SPATIAL,Pavilions (mandapa) may be installed in front of temples (prasada).
mandapa.adhisthana,prasada.adhisthana,HAS_DIMENSION_RATIO,0.857,MEASUREMENT,The dimensions of a temple pavilion's base (adhisthana) can be 6/7ths (1 - 1/7) of the main temple's base dimensions.
mandapa.stambha,prasada.stambha,HAS_DIMENSION_RATIO,0.875,MEASUREMENT,The dimensions of a temple pavilion's pillars (stambha) can be 7/8ths (1 - 1/8) of the main temple's pillar dimensions.
mandapa.prastara,prasada.prastara,HAS_DIMENSION_RATIO,0.9,MEASUREMENT,The dimensions of a temple pavilion's entablature (prastara) can be 9/10ths (1 - 1/10) of the main temple's entablature dimensions.
mandapa_6,prasada,HAS_PROPERTY_EQUAL_TO,,SPATIAL,The orientation (dik) of a pavilion is the same as that of the temple it precedes.
mandapa_6,prasada,HAS_PROPERTY_EQUAL_TO,,MEASUREMENT,The overall proportions (mana) of a pavilion are the same as those prescribed for the temple it precedes.
bhitti.bahala,stambha.vyasa,HAS_DIMENSION_RATIO,5.0,MEASUREMENT,The thickness (bahala) of a pavilion wall can be five times the diameter (vyasa) of its pillars.
bhitti.bahala,stambha.vyasa,HAS_DIMENSION_RATIO,0.75,MEASUREMENT,"If the pillars are made of wood (daru), the wall thickness (bahala) can be three-quarters of the pillar diameter."
kudyastambha.vistara,bhitti.bahala,HAS_DIMENSION_EQUAL_TO,,MEASUREMENT,The width (vistara) of a pilaster (kudyastambha) may be equal to the thickness (bahala) of the wall.
garbhanyasa,stambha_pada,LOCATED_AT,,SPATIAL,The foundation deposit (garbhanyasa) of a pavilion may be placed at the bottom of the pillar located in the south of the inner court (angana).
garbhanyasa,stambha_5,LOCATED_BELOW,,SPATIAL,The foundation deposit (garbhanyasa) of a pavilion may be placed under the pillar to the right of the door (dvara).
garbhanyasa,stambha_kona,LOCATED_AT,,SPATIAL,The foundation deposit (garbhanyasa) of a pavilion may be placed at the corner where the second pillar is located.
alindra_2,mandapa_6,LOCATED_AT,,SPATIAL,"A gallery (Alinda) may be located in front of, behind, or all around a pavilion (Mandapa)."
alindra_2,mandapa_6,HAS_DIMENSION_RATIO,1.0,MEASUREMENT,The width of a gallery (Alinda) should be one unit (aṁśa) calculated from the width and length of its associated pavilion (Mandapa).
alindra_2,mandapa_6,LOCATED_AT,,SPATIAL,"For pavilions intended for gods (Deva), brahmins (Brahmana), and kings (Rajan), the gallery (Alinda) must be arranged all around the structure."
alindra_2,mandapa_6,HAS_DIMENSION_RATIO,1.5,MEASUREMENT,"For pavilions of gods, brahmins, and kings, the gallery (Alinda) width can be one and a half units (aṁśa) relative to the pavilion's dimensions."
tāla_3,malika,PART_OF,,HIERARCHY,"A Malika building can be composed of one, two, or three storeys (Tala)."
AyaVistara,stambha_5,LOCATED_AT,,MEASUREMENT,"According to one school of thought, the primary lengthwise (Aya) and widthwise (Vistara) dimensions of a building are to be measured from the exterior edge of the pillars (Stambha)."
AyaVistara,bhitti,LOCATED_AT,,MEASUREMENT,"According to another school of thought, the primary lengthwise (Aya) and widthwise (Vistara) dimensions of a building are to be measured from the central axis (Akṣa) of the walls (Bhitti)."
SalaSikhara,mandapa_6,PART_OF,,HIERARCHY,A pavilion (Mandapa) constructed as a dwelling may be built with a wagon-roof (Sala Sikhara).
KutaSikhara,mandapa_6,PART_OF,,HIERARCHY,A pavilion (Mandapa) constructed as a dwelling may be built with a hipped roof (Kuta Sikhara).
mandapa_6,AyatasraVastu,IS_A,,DEFINITION,"Pavilions (Mandapa) can be rectangular (Ayatasra). Rectangular pavilions are suitable for all social classes, including Vaisya and Sudra."
mandapa_6,CaturasraVastu,IS_A,,DEFINITION,"Pavilions (Mandapa) can be square (Caturasra). Square pavilions are suitable for gods (Deva), brahmins (Brahmana), and kings (Rajan)."
bhadra_2,mandapa_6,PART_OF,,HIERARCHY,"A pavilion (Mandapa) can be designed with one, two, three, or four facades, which may feature jutting porches (Bhadra)."
vatayana,mandapa_6,PART_OF,,HIERARCHY,A pavilion (Mandapa) may incorporate lanterns or decorative windows (Vatayana) in its upper sections.
vitana,mandapa_6,PART_OF,,HIERARCHY,A pavilion (Mandapa) may contain a canopy (Vitana) in its central area.
angana_3,mandapa_6,PART_OF,,HIERARCHY,A pavilion (Mandapa) may be designed with an inner court (Aṅgaṇa) at its center.
mallavasanta,śālā_7,IS_A,,HIERARCHY,Mallavasanta is the first of nine types of halls (Sala).
pañcavasanta,śālā_7,IS_A,,HIERARCHY,Pancavasanta is one of nine types of halls (Sala).
ekavasanta,śālā_7,IS_A,,HIERARCHY,Ekavasanta is one of nine types of halls (Sala).
sarvatobhadra_8,śālā_7,IS_A,,HIERARCHY,Sarvatobhadra is one of nine types of halls (Sala).
Parvatakurmaka,śālā_7,IS_A,,HIERARCHY,Parvatakurmaka is one of nine types of halls (Sala).
Mabendra,śālā_7,IS_A,,HIERARCHY,Mabendra is one of nine types of halls (Sala).
Somaurtta,śālā_7,IS_A,,HIERARCHY,Somaurtta is one of nine types of halls (Sala).
sukavimana,śālā_7,IS_A,,HIERARCHY,Sukavimana is one of nine types of halls (Sala).
sripratisthita,śālā_7,IS_A,,HIERARCHY,Sripatisthita is one of nine types of halls (Sala).
āya,vistara_2,HAS_DIMENSION_RATIO,,MEASUREMENT,"For halls (Sala) intended for gods and men, the length (Aya) must be greater than the width (Vistara) by one, two, three, or four units (aṁśa)."
śālā_7,mandapa_6,HAS_PROPORTIONS_LIKE,,DEFINITION,The ornamentation and proportions of a hall's (Sala) walls and pillars should follow the same rules specified for pavilions (Mandapa).
śālā_7,prasada,HAS_PROPORTIONS_LIKE,,DEFINITION,"For a hall (Sala), all architectural elements located above the consoles of the entablature are to be designed like the corresponding elements of a temple (Prasada)."
Mandapika,śālā_7,IS_A,,DEFINITION,A 'kiosk' (Mandapika) is defined as a square hall equipped with corner rafters (Karna Tula) but specifically lacking valaksitasvasti at its corners.
vistara_2,aṁśa_3,HAS_DIMENSION_RATIO,1.0,MEASUREMENT,The width (Vistara) of a Mallavasanta hall is defined as one unit (aṁśa).
stambha_5,mallavasanta,PART_OF,,HIERARCHY,A Mallavasanta hall is composed of four pillars (Stambha).
pucchavalakṣa,mallavasanta,PART_OF,,HIERARCHY,A Mallavasanta hall is specified to have eight pucchavalaksa.
pañcavasanta,CaturasraSala,IS_A,,DEFINITION,The Pancavasanta is a type of hall (Sala) with a square plan.
vistara_2,aṁśa_3,HAS_DIMENSION_RATIO,2.0,MEASUREMENT,The width (Vistara) of a Pancavasanta hall is defined as two units (aṁśa).
stambha_5,pañcavasanta,PART_OF,,HIERARCHY,A Pancavasanta hall is composed of eight pillars (Stambha).
tula_3,pañcavasanta,PART_OF,,HIERARCHY,A Pancavasanta hall is constructed with eight long rafters (Tula).
svastivalaksa,pañcavasanta,PART_OF,,HIERARCHY,A Pancavasanta hall is specified to have eight svastikavalaksa.
kuta_7,pañcavasanta,PART_OF,,HIERARCHY,A Pancavasanta hall is designed with a Kuta (aedicule) at each of its corners.
EkavasantakaŚālā,CaturaśraŚālā,IS_A,,HIERARCHY,The Ekavasantaka hall is defined as a type of square hall (Caturaśra Śālā).
EkavasantakaŚālā_vistāra,bhaga,HAS_DIMENSION_RATIO,3.0,MEASUREMENT,The width (vistāra) of an Ekavasantaka hall is specified as three proportional units (bhāga).
EkavasantakaŚālā_āyāma,bhaga,HAS_DIMENSION_RATIO,3.0,MEASUREMENT,"The length (āyāma) of an Ekavasantaka hall is specified as three proportional units (bhāga), consistent with its square shape."
stambha_5,EkavasantakaŚālā,PART_OF,,MEASUREMENT,An Ekavasantaka hall is specified to be constructed with twelve pillars (stambha).
svastipuccha,EkavasantakaŚālā,PART_OF,,MEASUREMENT,An Ekavasantaka hall incorporates sixteen svastipuccha elements.
kuta_7,EkavasantakaŚālā,PART_OF,,MEASUREMENT,An Ekavasantaka hall is composed of thirteen kuta (aedicules).
valakṣa,EkavasantakaŚālā,PART_OF,,MEASUREMENT,An Ekavasantaka hall comprises eighteen valaksa elements.
SarvatobhadraŚālā,CaturaśraŚālā,IS_A,,HIERARCHY,The Sarvatobhadra hall is defined as a type of square hall (Caturaśra Śālā).
SarvatobhadraŚālā_vistāra,bhaga,HAS_DIMENSION_RATIO,4.0,MEASUREMENT,The width (vistāra) of a Sarvatobhadra hall is specified as four proportional units (bhāga).
SarvatobhadraŚālā_āyāma,bhaga,HAS_DIMENSION_RATIO,4.0,MEASUREMENT,The length (āyāma) of a Sarvatobhadra hall is specified as four proportional units (bhāga).
bāhyastambha,SarvatobhadraŚālā,PART_OF,,MEASUREMENT,A Sarvatobhadra hall has sixteen peripheral pillars (bāhyastambha).
antastambha,SarvatobhadraŚālā,PART_OF,,MEASUREMENT,A Sarvatobhadra hall has eight interior pillars (antastambha).
dīrghavaṃśa,SarvatobhadraŚālā,PART_OF,,MEASUREMENT,A Sarvatobhadra hall is constructed with eight long rafters (dīrghavaṃśa).
kuta_7,SarvatobhadraŚālā,PART_OF,,MEASUREMENT,A Sarvatobhadra hall is composed of sixteen kuta (aedicules).
svastipuccha,SarvatobhadraŚālā,PART_OF,,MEASUREMENT,A Sarvatobhadra hall incorporates twenty-four svastipuccha elements.
valakṣa,SarvatobhadraŚālā,PART_OF,,MEASUREMENT,A Sarvatobhadra hall comprises forty-eight valaksa elements.
madhyayaṣṭi,SarvatobhadraŚālā,PART_OF,,MEASUREMENT,A Sarvatobhadra hall is designed with a single median newel (madhyayaṣṭi).
ParvatakurmakaŚālā,ĀyataŚālā,IS_A,,HIERARCHY,The Parvatakurmaka hall is defined as a type of rectangular hall (Āyata Śālā).
ParvatakurmakaŚālā_vistāra,ParvatakurmakaŚālā_āyāma,HAS_DIMENSION_RATIO,0.8,MEASUREMENT,The Parvatakurmaka hall has a width-to-length ratio of 4:5.
bāhyastambha,ParvatakurmakaŚālā,PART_OF,,MEASUREMENT,A Parvatakurmaka hall has eighteen peripheral pillars (bāhyastambha).
antastambha,ParvatakurmakaŚālā,PART_OF,,MEASUREMENT,A Parvatakurmaka hall has ten interior pillars (antastambha).
vamsa_5,ParvatakurmakaŚālā,PART_OF,,MEASUREMENT,A Parvatakurmaka hall is constructed with eight rafters (vaṃśa).
bāhyakūṭa,ParvatakurmakaŚālā,PART_OF,,MEASUREMENT,A Parvatakurmaka hall features sixteen exterior kuta (bāhyakūṭa).
antakūṭa,ParvatakurmakaŚālā,PART_OF,,MEASUREMENT,A Parvatakurmaka hall features fourteen interior kuta (antakūṭa).
valakṣa,ParvatakurmakaŚālā,PART_OF,,MEASUREMENT,A Parvatakurmaka hall comprises sixty-four valaksa elements.
